idx,name,description,label,software
4065,default_domain_name,Optional domain name to use with v3 API and v2 parameters. It will be used for both the user and project domain in v3 and ignored in v2  authentication.,environment,nova
4066,user_id,User ID,environment,nova
4067,username,Username,environment,nova
4068,user_domain_id,User's domain id,environment,nova
4069,user_domain_name,User's domain name,environment,nova
4070,password,User's password,security,nova
4071,tenant_id,Tenant ID,environment,nova
4072,tenant_name,Tenant Name,environment,nova
4073,service_type,The default service_type for endpoint URL discovery.,environment,nova
4074,service_name,The default service_name for endpoint URL discovery.,environment,nova
4075,valid_interfaces,"List of interfaces, in order of preference, for endpoint URL.",security,nova
4076,region_name,The default region_name for endpoint URL discovery.,environment,nova
4077,endpoint_override,"Always use this endpoint URL for requests for this client. NOTE: The  unversioned endpoint should be specified here; to request a particular  API version, use the version, min-version, and/or max-version options.",others,nova
4078,connection,The SQLAlchemy connection string to use to connect to the database.,others,nova
4079,connection_parameters,Optional URL parameters to append onto the connection URL at connect time; specify as param1=value1&param2=value2&',environment,nova
4080,sqlite_synchronous,"If True, SQLite uses synchronous mode.",others,nova
4081,slave_connection,The SQLAlchemy connection string to use to connect to the slave database.,environment,nova
4082,mysql_sql_mode,"The SQL mode to be used for MySQL sessions. This option, including  the default, overrides any server-set SQL mode. To use whatever SQL mode is set by the server configuration, set this to no value. Example:  mysql_sql_mode=",others,nova
4083,connection_recycle_time,Connections which have been present in the connection pool longer  than this number of seconds will be replaced with a new one the next  time they are checked out from the pool.,reliability,nova
4084,max_pool_size,Maximum number of SQL connections to keep open in a pool. Setting a value of 0 indicates no limit.,reliability,nova
4085,max_retries,Maximum number of database connection retries during startup. Set to -1 to specify an infinite retry count.,reliability,nova
4086,retry_interval,Interval between retries of opening a SQL connection.,reliability,nova
4087,max_overflow,"If set, use this value for max_overflow with SQLAlchemy.",reliability,nova
4088,connection_debug,"Verbosity of SQL debugging information: 0=None, 100=Everything.",debuggability,nova
4089,connection_trace,Add Python stack traces to SQL as comment strings.,debuggability,nova
4090,pool_timeout,"If set, use this value for pool_timeout with SQLAlchemy.",reliability,nova
4091,proc_units_factor,"Factor used to calculate the amount of physical processor compute power given to each vCPU. E.g. A value of 1.0 means a whole physical processor, whereas 0.05 means 1/20th of a physical processor.",performance,nova
4092,disk_driver,The disk driver to use for PowerVM disks. PowerVM provides support for localdisk and PowerVM Shared Storage Pool disk drivers.,environment,nova
4093,volume_group_name,"Volume Group to use for block device operations. If disk_driver is localdisk, then this attribute must be specified. It is strongly recommended NOT to use rootvg since that is used by the management partition and filling it will cause failures.",reliability,nova
4094,user,User that the privsep daemon should run as.,environment,nova
4095,group,Group that the privsep daemon should run as.,environment,nova
4096,capabilities,List of Linux capabilities retained by the privsep daemon.,others,nova
4097,thread_pool_size,The number of threads available for privsep to concurrently run processes. Defaults to the number of CPU cores in the system.,performance,nova
4098,helper_command,"Command to invoke to start the privsep daemon if not using the 'fork' method. If not specified, a default is generated using 'sudo  privsep-helper' and arguments designed to recreate the current  configuration. This command must accept suitable --privsep_context and  --privsep_sock_path arguments.",others,nova
4099,enabled,Enable the profiling for all services on this node.,performance,nova
4100,trace_sqlalchemy,Enable SQL requests profiling in services.,performance,nova
4101,hmac_keys,Secret key(s) to use for encrypting context data for performance profiling.,security,nova
4102,connection_string,Connection string for a notifier backend.,others,nova
4103,es_doc_type,Document type for notification indexing in elasticsearch.,others,nova
4104,es_scroll_time,"This parameter is a time value parameter (for example: es_scroll_time=2m), indicating for how long the nodes that participate in the search will maintain relevant resources in order to continue and support it.",reliability,nova
4105,es_scroll_size,Elasticsearch splits large requests in batches. This parameter defines maximum size of each batch (for example: es_scroll_size=10000).,performance,nova
4106,socket_timeout,Redissentinel provides a timeout option on the connections. This parameter defines that timeout (for example: socket_timeout=0.1).,reliability,nova
4107,sentinel_service_name,Redissentinel uses a service name to identify a master redis service. This parameter defines the name (for example: sentinal_service_name=mymaster).,environment,nova
4108,filter_error_trace,Enable filter traces that contain error/exception to a separated place.,debuggability,nova
4109,instances,The number of instances allowed per project.,reliability,nova
4110,cores,The number of instance cores or vCPUs allowed per project.,performance,nova
4111,ram,The number of megabytes of instance RAM allowed per project.,performance,nova
4112,floating_ips,The number of floating IPs allowed per project.,others,nova
4113,fixed_ips,The number of fixed IPs allowed per project.,reliability,nova
4114,metadata_items,The number of metadata items allowed per instance.,reliability,nova
4115,injected_files,The number of injected files allowed.,reliability,nova
4116,injected_file_content_bytes,The number of bytes allowed per injected file.,reliability,nova
4117,injected_file_path_length,The maximum allowed injected file path length.,reliability,nova
4118,security_groups,The number of security groups per project.,security,nova
4119,security_group_rules,The number of security rules per security group.,security,nova
4120,key_pairs,The maximum number of key pairs allowed per user.,security,nova
4121,server_groups,The maxiumum number of server groups per project.,reliability,nova
4122,server_group_members,The maximum number of servers per server group.,reliability,nova
4123,driver,Provides abstraction for quota checks. Users can configure a specific driver to use for quota checks.,environment,nova
4124,recheck_quota,Recheck quota after resource creation to prevent allowing quota to be exceeded.,reliability,nova
4125,enabled,Enable Remote Desktop Protocol (RDP) related features.,others,nova
4126,html5_proxy_base_url,The URL an end user would use to connect to the RDP HTML5 console proxy. The console proxy service is called with this token-embedded URL and establishes the connection to the proper instance.,environment,nova
4127,host,Debug host (IP or name) to connect to. This command line parameter is used when you want to connect to a nova service via a debugger running on a different host.,debuggability,nova
4128,port,Debug port to connect to. This command line parameter allows you to specify the port you want to use to connect to a nova service via a debugger running on different host.,debuggability,nova
4129,driver,"The class of the driver used by the scheduler. This should be chosen from one of the entrypoints under the namespace 'nova.scheduler.driver' of file 'setup.cfg'. If nothing is specified in this option, the 'filter_scheduler' is used.",environment,nova
4130,periodic_task_interval,Periodic task interval.,reliability,nova
4131,max_attempts,"This is the maximum number of attempts that will be made for a given instance build/move operation. It limits the number of alternate hosts returned by the scheduler. When that list of hosts is exhausted, a MaxRetriesExceeded exception is raised and the instance is set to an error state.",reliability,nova
4132,discover_hosts_in_cells_interval,Periodic task interval.,reliability,nova
4133,max_placement_results,This setting determines the maximum limit on results received from the placement service during a scheduling operation. It effectively limits the number of hosts that may be considered for scheduling requests that match a large number of candidates.,reliability,nova
4134,workers,"Number of workers for the nova-scheduler service. The default will be the number of CPUs available if using the 'filter_scheduler' scheduler driver, otherwise the default will be 1.",performance,nova
4135,limit_tenants_to_placement_aggregate,"This setting causes the scheduler to look up a host aggregate with the metadata key of filter_tenant_id set to the project of an incoming request, and request results from placement be limited to that aggregate. Multiple tenants may be added to a single aggregate by appending a serial number to the key, such as filter_tenant_id:123.",others,nova
4136,placement_aggregate_required_for_tenants,"This setting, when limit_tenants_to_placement_aggregate=True, will control whether or not a tenant with no aggregate affinity will be allowed to schedule to any available node. If aggregates are used to limit some tenants but not all, then this should be False. If all tenants should be confined via aggregate, then this should be True to prevent them from receiving unrestricted scheduling to any available node.",others,nova
4137,query_placement_for_availability_zone,"This setting causes the scheduler to look up a host aggregate with the metadata key of availability_zone set to the value provided by an incoming request, and request results from placement be limited to that aggregate.",others,nova
4138,enabled,Enable the serial console feature.,others,nova
4139,port_range,A range of TCP ports a guest can use for its backend.,environment,nova
4140,base_url,The URL an end user would use to connect to the nova-serialproxy service.,environment,nova
4141,proxyclient_address,The IP address to which proxy clients (like nova-serialproxy) should connect to get the serial console of an instance.,environment,nova
4142,serialproxy_host,The IP address which is used by the nova-serialproxy service to listen for incoming requests.,environment,nova
4143,serialproxy_port,The port number which is used by the nova-serialproxy service to listen for incoming requests.,environment,nova
4144,send_service_user_token,"When True, if sending a user token to a REST API, also send a service token.",others,nova
4145,cafile,PEM encoded Certificate Authority to use when verifying HTTPs connections.,security,nova
4146,certfile,PEM encoded client certificate cert file,security,nova
4147,keyfile,PEM encoded client certificate key file,security,nova
4148,insecure,Verify HTTPS connections.,security,nova
4149,timeout,Timeout value for http requests,reliability,nova
4150,collect_timing,Collect per-API call timing information.,debuggability,nova
4151,split_loggers,Log requests to multiple loggers.,debuggability,nova
4152,auth_type,Authentication type to load,security,nova
4153,auth_section,Config Section from which to load plugin specific options,security,nova
4154,auth_url,Authentication URL,security,nova
4155,system_scope,Scope for system operations,reliability,nova
4156,domain_id,Domain ID to scope to,environment,nova
4157,domain_name,Domain name to scope to,environment,nova
4158,project_id,Project ID to scope to,environment,nova
4159,project_name,Project name to scope to,environment,nova
4160,project_domain_id,Domain ID containing project,environment,nova
4161,project_domain_name,Domain name containing project,environment,nova
4162,trust_id,Trust ID,security,nova
4163,default_domain_id,Optional domain ID to use with v3 and v2 parameters. It will be used  for both the user and project domain in v3 and ignored in v2  authentication.,environment,nova
4164,default_domain_name,Optional domain name to use with v3 API and v2 parameters. It will be used for both the user and project domain in v3 and ignored in v2  authentication.,environment,nova
4165,user_id,User ID,environment,nova
4166,username,Username,environment,nova
4167,user_domain_id,User's domain id,environment,nova
4168,user_domain_name,User's domain name,environment,nova
4169,password,User's password,security,nova
4170,tenant_id,Tenant ID,environment,nova
4171,tenant_name,Tenant Name,environment,nova
4172,enabled,Enable SPICE related features.,others,nova
4173,agent_enabled,Enable the SPICE guest agent support on the instances.,others,nova
4174,html5proxy_base_url,Location of the SPICE HTML5 console proxy.,environment,nova
4175,server_listen,The  address where the SPICE server running on the instances should listen.,environment,nova
4176,server_proxyclient_address,The address used by nova-spicehtml5proxy client to connect to instance console.,environment,nova
4177,keymap,A keyboard layout which is supported by the underlying hypervisor on this node.,others,nova
4178,html5proxy_host,IP address or a hostname on which the nova-spicehtml5proxy service listens for incoming requests.,environment,nova
4179,html5proxy_port,Port on which the nova-spicehtml5proxy service listens for incoming requests.,environment,nova
4180,compute,Compute RPC API version cap.,environment,nova
4181,cells,Cells RPC API version cap.,environment,nova
4182,intercell,Intercell RPC API version cap.,environment,nova
4183,cert,Cert RPC API version cap.,environment,nova
4184,scheduler,Scheduler RPC API version cap.,environment,nova
4185,conductor,Conductor RPC API version cap.,environment,nova
4186,console,Console RPC API version cap.,environment,nova
4187,consoleauth,Consoleauth RPC API version cap.,environment,nova
4188,network,Network RPC API version cap.,environment,nova
4189,baseapi,Base API RPC API version cap.,environment,nova
4190,root_token_id,root token for vault,security,nova
4191,approle_role_id,AppRole role_id for authentication with vault,security,nova
4192,approle_secret_id,AppRole secret_id for authentication with vault,security,nova
4193,kv_mountpoint,"Mountpoint of KV store in Vault to use, for example: secret",others,nova
4194,vault_url,"Use this endpoint to connect to Vault, for example: 'http://127.0.0.1:8200'",environment,nova
4195,ssl_ca_crt_file,Absolute path to ca cert file,security,nova
4196,use_ssl,SSL Enabled/Disabled,security,nova
4197,cafile,PEM encoded Certificate Authority to use when verifying HTTPs connections.,security,nova
4198,certfile,PEM encoded client certificate cert file,security,nova
4199,keyfile,PEM encoded client certificate key file,security,nova
4200,insecure,Verify HTTPS connections.,security,nova
4201,timeout,Timeout value for http requests,reliability,nova
4202,collect_timing,Collect per-API call timing information.,debuggability,nova
4203,split_loggers,Log requests to multiple loggers.,debuggability,nova
4204,auth_type,Authentication type to load,security,nova
4205,auth_section,Config Section from which to load plugin specific options,security,nova
4206,auth_url,Authentication URL,security,nova
4207,system_scope,Scope for system operations,reliability,nova
4208,domain_id,Domain ID to scope to,environment,nova
4209,domain_name,Domain name to scope to,environment,nova
4210,project_id,Project ID to scope to,environment,nova
4211,project_name,Project name to scope to,environment,nova
4212,project_domain_id,Domain ID containing project,environment,nova
4213,project_domain_name,Domain name containing project,environment,nova
4214,trust_id,Trust ID,security,nova
4215,default_domain_id,Optional domain ID to use with v3 and v2 parameters. It will be used  for both the user and project domain in v3 and ignored in v2  authentication.,environment,nova
4216,default_domain_name,Optional domain name to use with v3 API and v2 parameters. It will be used for both the user and project domain in v3 and ignored in v2  authentication.,environment,nova
4217,user_id,User ID,environment,nova
4218,username,Username,environment,nova
4219,user_domain_id,User's domain id,environment,nova
4220,user_domain_name,User's domain name,environment,nova
4221,password,User's password,security,nova
4222,tenant_id,Tenant ID,environment,nova
4223,tenant_name,Tenant Name,environment,nova
4224,vlan_interface,This option specifies the physical ethernet adapter name for VLAN networking.,others,nova
4225,integration_bridge,This option should be configured only when using the NSX-MH Neutron plugin. This is the name of the integration bridge on the ESXi server or host. This should not be set for any other Neutron plugin. Hence the default value is not set.,others,nova
4226,console_delay_seconds,Set this value if affected by an increased network latency causing repeated characters when typing in a remote console.,reliability,nova
4227,serial_port_service_uri,Identifies the remote system where the serial port traffic will be sent.,environment,nova
4228,serial_port_proxy_uri,Identifies a proxy service that provides network access to the serial_port_service_uri.,environment,nova
4229,serial_log_dir,Specifies the directory where the Virtual Serial Port Concentrator is storing console log files. It should match the 'serial_log_dir' config value of VSPC.,environment,nova
4230,host_ip,Hostname or IP address for connection to VMware vCenter host.,environment,nova
4231,host_port,Port for connection to VMware vCenter host.,environment,nova
4232,host_username,Username for connection to VMware vCenter host.,environment,nova
4233,host_password,Password for connection to VMware vCenter host.,security,nova
4234,ca_file,Specifies the CA bundle file to be used in verifying the vCenter server certificate.,security,nova
4235,insecure,"If true, the vCenter server certificate is not verified. If false, then the default CA truststore is used for verification.",security,nova
4236,cluster_name,Name of a VMware Cluster ComputeResource.,environment,nova
4237,datastore_regex,Regular expression pattern to match the name of datastore.,others,nova
4238,task_poll_interval,Time interval in seconds to poll remote tasks invoked on VMware VC server.,reliability,nova
4239,api_retry_count,"Number of times VMware vCenter server API must be retried on connection failures, e.g. socket error, etc.",reliability,nova
4240,vnc_port,This option specifies VNC starting port.,environment,nova
4241,vnc_port_total,Total number of VNC ports.,others,nova
4242,vnc_keymap,Keymap for VNC.,others,nova
4243,use_linked_clone,This option enables/disables the use of linked clone.,others,nova
4244,connection_pool_size,This option sets the http connection pool size,performance,nova
4245,pbm_enabled,This option enables or disables storage policy based placement of instances.,others,nova
4246,pbm_wsdl_location,This option specifies the PBM service WSDL file location URL.,environment,nova
4247,pbm_default_policy,This option specifies the default policy to be used.,performance,nova
4248,maximum_objects,This option specifies the limit on the maximum number of objects to return in a single result.,reliability,nova
4249,cache_prefix,This option adds a prefix to the folder where cached images are stored,others,nova
4250,enabled,Enable VNC related features.,others,nova
4251,keymap,Keymap for VNC.,environment,nova
4252,server_listen,The IP address or hostname on which an instance should listen to for incoming VNC connection requests on this node.,environment,nova
4253,server_proxyclient_address,"Private, internal IP address or hostname of VNC console proxy.",environment,nova
4254,novncproxy_base_url,Public address of noVNC VNC console proxy.,environment,nova
4255,xvpvncproxy_host,IP address or hostname that the XVP VNC console proxy should bind to.,environment,nova
4256,xvpvncproxy_port,Port that the XVP VNC console proxy should bind to.,environment,nova
4257,xvpvncproxy_base_url,Public URL address of XVP VNC console proxy.,environment,nova
4258,novncproxy_host,IP address that the noVNC console proxy should bind to.,environment,nova
4259,novncproxy_port,Port that the noVNC console proxy should bind to.,environment,nova
4260,auth_schemes,The authentication schemes to use with the compute node.,security,nova
4261,vencrypt_client_key,The path to the client certificate PEM file (for x509),security,nova
4262,vencrypt_client_cert,The path to the client key file (for x509),security,nova
4263,vencrypt_ca_certs,The path to the CA certificate PEM file,security,nova
4264,disable_rootwrap,Use sudo instead of rootwrap.,security,nova
4265,disable_libvirt_livesnapshot,Disable live snapshots when using the libvirt driver.,others,nova
4266,handle_virt_lifecycle_events,Enable handling of events emitted from compute drivers.,others,nova
4267,disable_group_policy_check_upcall,Disable the server group policy check upcall in compute.,others,nova
4268,enable_consoleauth,Enable the consoleauth service to avoid resetting unexpired consoles.,security,nova
4269,enable_numa_live_migration,Enable live migration of instances with NUMA topologies.,others,nova
4270,ensure_libvirt_rbd_instance_dir_cleanup,Ensure the instance directory is removed during clean up when using rbd.,security,nova
4271,api_paste_config,This option represents a file name for the paste.deploy config for nova-api.,environment,nova
4272,wsgi_log_format,"It represents a python format string that is used as the template to generate log lines. The following values can be formatted into it: client_ip, date_time, request_line, status_code, body_length, wall_seconds.",others,nova
4273,secure_proxy_ssl_header,"This option specifies the HTTP header used to determine the protocol scheme for the original request, even if it was removed by a SSL terminating proxy.",security,nova
4274,ssl_ca_file,This option allows setting path to the CA certificate file that should be used to verify connecting clients.,security,nova
4275,ssl_cert_file,This option allows setting path to the SSL certificate of API server.,security,nova
4276,ssl_key_file,This option specifies the path to the file where SSL private key of API server is stored when SSL is in effect.,security,nova
4277,tcp_keepidle,This option sets the value of TCP_KEEPIDLE in seconds for each server socket. It specifies the duration of time to keep connection active. TCP generates a KEEPALIVE transmission for an application that requests to keep connection active. Not supported on OS X.,reliability,nova
4278,default_pool_size,This option specifies the size of the pool of greenthreads used by wsgi. It is possible to limit the number of concurrent connections using this option.,performance,nova
4279,max_header_line,This option specifies the maximum line size of message headers to be accepted. max_header_line may need to be increased when using large tokens (typically those generated by the Keystone v3 API with big service catalogs).,reliability,nova
4280,keep_alive,"This option allows using the same TCP connection to send and receive multiple HTTP requests/responses, as opposed to opening a new one for every single request/response pair. HTTP keep-alive indicates HTTP connection reuse.",reliability,nova
4281,client_socket_timeout,This option specifies the timeout for client connections' socket operations. If an incoming connection is idle for this number of seconds it will be closed. It indicates timeout on individual read/writes on the socket connection. To wait forever set to 0.,reliability,nova
4282,agent_timeout,Number of seconds to wait for agent's reply to a request.,reliability,nova
4283,agent_version_timeout,Number of seconds to wait for agent't reply to version request.,reliability,nova
4284,agent_resetnetwork_timeout,Number of seconds to wait for agent's reply to resetnetwork request.,reliability,nova
4285,agent_path,Path to locate guest agent on the server.,environment,nova
4286,disable_agent,Disables the use of XenAPI agent.,others,nova
4287,use_agent_default,Whether or not to use the agent by default when its usage is enabled but not indicated by the image.,others,nova
4288,login_timeout,Timeout in seconds for XenAPI login.,reliability,nova
4289,connection_concurrent,Maximum number of concurrent XenAPI connections.,reliability,nova
4290,cache_images,Cache glance images locally.,performance,nova
4291,image_compression_level,Compression level for images.,performance,nova
4292,default_os_type,Default OS type used when uploading an image to glance,environment,nova
4293,block_device_creation_timeout,Time in secs to wait for a block device to be created,reliability,nova
4294,max_kernel_ramdisk_size,Maximum size in bytes of kernel or ramdisk images.,reliability,nova
4295,sr_matching_filter,Filter for finding the SR to be used to install guest instances on.,others,nova
4296,sparse_copy,Whether to use sparse_copy for copying data on a resize down. (False will use standard dd). This speeds up resizes down considerably since large runs of zeros won't have to be rsynced.,performance,nova
4297,num_vbd_unplug_retries,"Maximum number of retries to unplug VBD. If set to 0, should try once, no retries.",reliability,nova
4298,ipxe_network_name,Name of network to use for booting iPXE ISOs.,environment,nova
4299,ipxe_boot_menu_url,URL to the iPXE boot menu.,environment,nova
4300,ipxe_mkisofs_cmd,Name and optionally path of the tool used for ISO image creation.,environment,nova
4301,connection_url,URL for connection to XenServer/Xen Cloud Platform. A special value of unix://local can be used to connect to the local unix socket.,environment,nova
4302,connection_username,Username for connection to XenServer/Xen Cloud Platform,environment,nova
