idx,name,description,label,software
1080,dfs.namenode.snapshot.capture.openfiles,"If true, snapshots taken will have an immutable shared copy of the open files that have valid leases. Even after the open files grow or shrink in size, snapshot will always have the previous point-in-time version of the open files, just like all other closed files. Default is false. Note: The file length captured for open files in snapshot is whats recorded in NameNode at the time of snapshot and it may be shorter than what the client has written till then. In order to capture the latest length, the client can call hflush/hsync with the flag SyncFlag.UPDATE_LENGTH on the open files handles.",reliability,hdfs
1081,dfs.namenode.snapshot.skip.capture.accesstime-only-change,"If accessTime of a file/directory changed but there is no other modification made to the file/directory, the changed accesstime will not be captured in next snapshot. However, if there is other modification made to the file/directory, the latest access time will be captured together with the modification in next snapshot.",reliability,hdfs
1082,dfs.pipeline.ecn,"If true, allows ECN (explicit congestion notification) from the Datanode.",performance,hdfs
1083,dfs.qjournal.accept-recovery.timeout.ms,Quorum timeout in milliseconds during accept phase of recovery/synchronization for a specific segment.,reliability,hdfs
1084,dfs.qjournal.finalize-segment.timeout.ms,Quorum timeout in milliseconds during finalizing for a specific segment.,reliability,hdfs
1085,dfs.qjournal.get-journal-state.timeout.ms,Timeout in milliseconds when calling getJournalState(). JournalNodes.,reliability,hdfs
1086,dfs.qjournal.new-epoch.timeout.ms,Timeout in milliseconds when getting an epoch number for write access to JournalNodes.,reliability,hdfs
1087,dfs.qjournal.prepare-recovery.timeout.ms,Quorum timeout in milliseconds during preparation phase of recovery/synchronization for a specific segment.,reliability,hdfs
1088,dfs.qjournal.queued-edits.limit.mb,Queue size in MB for quorum journal edits.,performance,hdfs
1089,dfs.qjournal.select-input-streams.timeout.ms,Timeout in milliseconds for accepting streams from JournalManagers.,reliability,hdfs
1090,dfs.qjournal.start-segment.timeout.ms,Quorum timeout in milliseconds for starting a log segment.,debuggability,hdfs
1091,dfs.qjournal.write-txns.timeout.ms,Write timeout in milliseconds when writing to a quorum of remote journals.,reliability,hdfs
1092,dfs.quota.by.storage.type.enabled,"If true, enables quotas based on storage type.",others,hdfs
1093,dfs.secondary.namenode.kerberos.principal,Kerberos principal name for the Secondary NameNode.,security,hdfs
1094,dfs.secondary.namenode.keytab.file,Kerberos keytab file for the Secondary NameNode.,environment,hdfs
1095,dfs.support.append,Enables append support on the NameNode.,others,hdfs
1096,dfs.web.authentication.filter,Authentication filter class used for WebHDFS.,security,hdfs
1097,dfs.web.authentication.simple.anonymous.allowed,"If true, allow anonymous user to access WebHDFS. Set to false to disable anonymous authentication.",security,hdfs
1098,dfs.webhdfs.netty.high.watermark,High watermark configuration to Netty for Datanode WebHdfs.,performance,hdfs
1099,dfs.webhdfs.netty.low.watermark,Low watermark configuration to Netty for Datanode WebHdfs.,performance,hdfs
1100,dfs.webhdfs.oauth2.access.token.provider,Access token provider class for WebHDFS using OAuth2. Defaults to org.apache.hadoop.hdfs.web.oauth2.ConfCredentialBasedAccessTokenProvider.,security,hdfs
1101,dfs.webhdfs.oauth2.client.id,Client id used to obtain access token with either credential or refresh token.,environment,hdfs
1102,dfs.webhdfs.oauth2.enabled,"If true, enables OAuth2 in WebHDFS",security,hdfs
1103,dfs.webhdfs.oauth2.refresh.url,URL against which to post for obtaining bearer token with either credential or refresh token.,environment,hdfs
1104,ssl.server.keystore.keypassword,Keystore key password for HTTPS SSL configuration,security,hdfs
1105,ssl.server.keystore.location,Keystore location for HTTPS SSL configuration,environment,hdfs
1106,ssl.server.keystore.password,Keystore password for HTTPS SSL configuration,security,hdfs
1107,dfs.balancer.keytab.enabled,Set to true to enable login using a keytab for Kerberized Hadoop.,security,hdfs
1108,dfs.balancer.address,The hostname used for a keytab based Kerberos login. Keytab based login can be enabled with dfs.balancer.keytab.enabled.,environment,hdfs
1109,dfs.balancer.keytab.file,The keytab file used by the Balancer to login as its service principal. The principal name is configured with dfs.balancer.kerberos.principal. Keytab based login can be enabled with dfs.balancer.keytab.enabled.,environment,hdfs
1110,dfs.balancer.kerberos.principal,The Balancer principal. This is typically set to balancer/_HOST@REALM.TLD. The Balancer will substitute _HOST with its own fully qualified hostname at startup. The _HOST placeholder allows using the same configuration setting on different servers. Keytab based login can be enabled with dfs.balancer.keytab.enabled.,others,hdfs
1111,ssl.server.truststore.location,Truststore location for HTTPS SSL configuration,environment,hdfs
1112,ssl.server.truststore.password,Truststore password for HTTPS SSL configuration,security,hdfs
1113,dfs.lock.suppress.warning.interval,Instrumentation reporting long critical sections will suppress consecutive warnings within this interval.,reliability,hdfs
1114,dfs.webhdfs.use.ipc.callq,Enables routing of webhdfs calls through rpc call queue,others,hdfs
1115,httpfs.buffer.size,The size buffer to be used when creating or opening httpfs filesystem IO stream.,performance,hdfs
1116,dfs.datanode.disk.check.min.gap,The minimum gap between two successive checks of the same DataNode volume. This setting supports multiple time unit suffixes as described in dfs.heartbeat.interval. If no suffix is specified then milliseconds is assumed.,reliability,hdfs
1117,dfs.datanode.disk.check.timeout,Maximum allowed time for a disk check to complete during DataNode startup. If the check does not complete within this time interval then the disk is declared as failed. This setting supports multiple time unit suffixes as described in dfs.heartbeat.interval. If no suffix is specified then milliseconds is assumed.,reliability,hdfs
1118,dfs.use.dfs.network.topology,Enables DFSNetworkTopology to choose nodes for placing replicas.,others,hdfs
1119,dfs.qjm.operations.timeout,Common key to set timeout for related operations in QuorumJournalManager. This setting supports multiple time unit suffixes as described in dfs.heartbeat.interval. If no suffix is specified then milliseconds is assumed.,reliability,hdfs
1120,dfs.reformat.disabled,"Disable reformat of NameNode. If it's value is set to ""true"" and metadata directories already exist then attempt to format NameNode will throw NameNodeFormatException.",reliability,hdfs
1121,AcceptFilter,Configures optimizations for a Protocol's Listener Sockets,performance,httpd
1122,AcceptPathInfo,Resources accept trailing pathname information,debuggability,httpd
1123,AccessFileName,Name of the distributed configuration file,environment,httpd
1124,AddAlt,"Alternate text to display for a file, instead of an icon selected by filename",others,httpd
1125,AddAltByEncoding,Alternate text to display for a file instead of an icon selected by MIME-encoding,others,httpd
1126,AddAltByType,"Alternate text to display for a file, instead of an icon selected by MIME content-type",others,httpd
1127,AddCharset,Maps the given filename extensions to the specified content charset,others,httpd
1128,AddDefaultCharset,Default charset parameter to be added when a response content-type is text/plain or text/html,environment,httpd
1129,AddDescription,Description to display for a file,others,httpd
1130,AddOutputFilterByType,assigns an output filter to a particular media-type,others,httpd
1131,AddType,Maps the given filename extensions onto the specified content type,others,httpd
1132,Alias,Maps URLs to filesystem locations,others,httpd
1133,AliasMatch,Maps URLs to filesystem locations using regular expressions,others,httpd
1134,AllowCONNECT,Ports that are allowed to CONNECT through the proxy,environment,httpd
1135,AllowEncodedSlashes,Determines whether encoded path separators in URLs are allowed to be passed through,security,httpd
1136,AsyncRequestWorkerFactor,Limit concurrent connections per process,reliability,httpd
1137,AuthDigestShmemSize,The amount of shared memory to allocate for keeping track of clients,reliability,httpd
1138,AuthLDAPCharsetConfig,Language to charset conversion configuration file,environment,httpd
1139,AuthnCacheEnable,Enable Authn caching configured anywhere,others,httpd
1140,AuthnCacheSOCache,Select socache backend provider to use,performance,httpd
1141,AuthnzFcgiDefineProvider,Defines a FastCGI application as a provider for authentication and/or authorization,security,httpd
1142,BalancerGrowth,Number of additional Balancers that can be added Post-configuration,performance,httpd
1143,BalancerInherit,Inherit ProxyPassed Balancers/Workers from the main server,others,httpd
1144,BalancerPersist,Attempt to persist changes made by the Balancer Manager across restarts.,others,httpd
1145,BrotliCompressionMaxInputBlock,Maximum input block size,performance,httpd
1146,BrotliCompressionWindow,Brotli sliding compression window size,performance,httpd
1147,BrotliFilterNote,Places the compression ratio in a note for logging,debuggability,httpd
1148,BufferedLogs,Buffer log entries in memory before writing to disk,debuggability,httpd
1149,BufferSize,Maximum size in bytes to buffer by the buffer filter,performance,httpd
1150,CacheDefaultExpire,The default duration to cache a document when no expiry date is specified.,performance,httpd
1151,CacheDetailHeader,Add an X-Cache-Detail header to the response.,others,httpd
1152,CacheDirLength,The number of characters in subdirectory names,others,httpd
1153,CacheDirLevels,The number of levels of subdirectories in the cache.,performance,httpd
1154,CacheDisable,Disable caching of specified URLs,performance,httpd
1155,CacheEnable,Enable caching of specified URLs using a specified storage manager,performance,httpd
1156,CacheFile,Cache a list of file handles at startup time,performance,httpd
1157,CacheHeader,Add an X-Cache header to the response.,others,httpd
1158,CacheIgnoreCacheControl,Ignore request to not serve cached content to client,others,httpd
1159,CacheIgnoreHeaders,Do not store the given HTTP header(s) in the cache.,others,httpd
1160,CacheIgnoreNoLastMod,Ignore the fact that a response has no Last Modified header.,others,httpd
1161,CacheIgnoreQueryString,Ignore query string when caching,performance,httpd
1162,CacheIgnoreURLSessionIdentifiers,Ignore defined session identifiers encoded in the URL when caching,performance,httpd
1163,CacheKeyBaseURL,Override the base URL of reverse proxied cache keys.,environment,httpd
1164,CacheLastModifiedFactor,The factor used to compute an expiry date based on the LastModified date.,performance,httpd
1165,CacheLock,Enable the thundering herd lock.,reliability,httpd
1166,CacheLockMaxAge,Set the maximum possible age of a cache lock.,security,httpd
1167,CacheLockPath,Set the lock path directory.,environment,httpd
1168,CacheMaxExpire,The maximum time in seconds to cache a document,performance,httpd
1169,CacheMaxFileSize,The maximum size (in bytes) of a document to be placed in the cache,performance,httpd
1170,CacheMinExpire,The minimum time in seconds to cache a document,performance,httpd
1171,CacheMinFileSize,The minimum size (in bytes) of a document to be placed in the cache,performance,httpd
1172,CacheNegotiatedDocs,Allows content-negotiated documents to be cached by proxy servers,performance,httpd
1173,CacheQuickHandler,Run the cache from the quick handler.,performance,httpd
1174,CacheReadSize,The minimum size (in bytes) of the document to read and be cached before sending the data downstream,performance,httpd
1175,CacheReadTime,The minimum time (in milliseconds) that should elapse while reading before data is sent downstream,reliability,httpd
1176,CacheRoot,The directory root under which cache files are stored,environment,httpd
1177,CacheSocacheMaxSize,The maximum size (in bytes) of an entry to be placed in the cache,performance,httpd
1178,CacheSocacheReadSize,The minimum size (in bytes) of the document to read and be cached before sending the data downstream,performance,httpd
1179,CacheSocacheReadTime,The minimum time (in milliseconds) that should elapse while reading before data is sent downstream,performance,httpd
1180,CacheStaleOnError,Serve stale content in place of 5xx responses.,reliability,httpd
1181,CacheStoreExpired,Attempt to cache responses that the server reports as expired,others,httpd
1182,CacheStoreNoStore,Attempt to cache requests or responses that have been marked as no-store.,others,httpd
1183,CacheStorePrivate,Attempt to cache responses that the server has marked as private,others,httpd
1184,CGIDScriptTimeout,The length of time to wait for more output from the CGI program,reliability,httpd
1185,CharsetDefault,Charset to translate into,environment,httpd
1186,CharsetOptions,Configures charset translation behavior,others,httpd
1187,CharsetSourceEnc,Source charset of files,environment,httpd
1188,CheckCaseOnly,Limits the action of the speling module to case corrections,reliability,httpd
1189,ContentDigest,Enables the generation of Content-MD5 HTTP Response headers,security,httpd
1190,CookieExpires,Expiry time for the tracking cookie,performance,httpd
1191,CookieName,Name of the tracking cookie,environment,httpd
1192,CookieStyle,Format of the cookie header field,others,httpd
1193,DavGenericLockDB,Location of the DAV lock database,environment,httpd
1194,DavLockDB,Location of the DAV lock database,environment,httpd
1195,DavMinTimeout,Minimum amount of time the server holds a lock on a DAV resource,reliability,httpd
1196,DBDExptime,Keepalive time for idle connections,reliability,httpd
1197,DBDInitSQL,Execute an SQL statement after connecting to a database,environment,httpd
1198,DBDKeep,Maximum sustained number of connections,reliability,httpd
1199,DBDMax,Maximum number of connections,reliability,httpd
1200,DBDMin,Minimum number of connections,reliability,httpd
1201,DBDParams,Parameters for database connection,others,httpd
1202,DBDPersist,Whether to use persistent connections,reliability,httpd
1203,DBDPrepareSQL,Define an SQL prepared statement,environment,httpd
1204,DBDriver,Specify an SQL driver,environment,httpd
1205,DefaultRuntimeDir,Base directory for the server run-time files,environment,httpd
1206,DeflateBufferSize,Fragment size to be compressed at one time by zlib,performance,httpd
1207,DeflateCompressionLevel,How much compression do we apply to the output,others,httpd
1208,DeflateFilterNote,Places the compression ratio in a note for logging,debuggability,httpd
1209,DeflateInflateLimitRequestBody,Maximum size of inflated request bodies,reliability,httpd
1210,DeflateMemLevel,How much memory should be used by zlib for compression,performance,httpd
1211,DeflateWindowSize,Zlib compression window size,performance,httpd
1212,DirectoryCheckHandler,Toggle how this module responds when another handler is configured,others,httpd
1213,DocumentRoot,Directory that forms the main document tree visible from the web,environment,httpd
1214,DumpIOInput,Dump all input data to the error log,debuggability,httpd
1215,DumpIOOutput,Dump all output data to the error log,debuggability,httpd
1216,EnableMMAP,Use memory-mapping to read files during delivery,performance,httpd
1217,EnableSendfile,Use the kernel sendfile support to deliver files to the client,others,httpd
1218,Error,Abort configuration parsing with a custom error message,debuggability,httpd
1219,ErrorDocument,What the server will return to the client in case of an error,debuggability,httpd
1220,ErrorLog,Location where the server will log errors,debuggability,httpd
1221,ErrorLogFormat,Format specification for error log entries,debuggability,httpd
1222,Example,Demonstration directive to illustrate the Apache module API,environment,httpd
1223,ExpiresActive,Enables generation of Expires headers,others,httpd
1224,ExpiresDefault,Default algorithm for calculating expiration time,performance,httpd
1225,ExtendedStatus,Keep track of extended status information for each request,debuggability,httpd
1226,ExtFilterDefine,Define an external filter,security,httpd
1227,FilterProtocol,Deal with correct HTTP protocol handling,others,httpd
1228,FilterTrace,Get debug/diagnostic information from mod_filter,debuggability,httpd
1229,GprofDir,Directory to write gmon.out profiling data to.,environment,httpd
1230,GracefulShutdownTimeout,Specify a timeout after which a gracefully shutdown server will exit.,reliability,httpd
1231,H2EarlyHints,Determine sending of 103 status codes,others,httpd
1232,H2MaxSessionStreams,Maximum number of active streams per HTTP/2 session.,performance,httpd
1233,H2MaxWorkerIdleSeconds,Maximum number of seconds h2 workers remain idle until shut down.,reliability,httpd
1234,H2MaxWorkers,Maximum number of worker threads to use per child process.,performance,httpd
1235,H2MinWorkers,Minimal number of worker threads to use per child process.,performance,httpd
1236,H2ModernTLSOnly,"Require HTTP/2 connections to be ""modern TLS"" only",security,httpd
1237,H2StreamMaxMemSize,Maximum amount of output data buffered per stream.,performance,httpd
1238,H2TLSCoolDownSecs,Configure the number of seconds of idle time on TLS before shrinking writes,reliability,httpd
1239,H2TLSWarmUpSize,Configure the number of bytes on TLS connection before doing max writes,reliability,httpd
1240,HeaderName,Name of the file that will be inserted at the top of the index listing,others,httpd
1241,HeartbeatAddress,Multicast address for heartbeat packets,environment,httpd
1242,HeartbeatListen,multicast address to listen for incoming heartbeat requests,environment,httpd
1243,HeartbeatMaxServers,Specifies the maximum number of servers that will be sending heartbeat requests to this server,reliability,httpd
1244,HostnameLookups,Enables DNS lookups on client IP addresses,others,httpd
1245,IdentityCheckTimeout,Determines the timeout duration for ident requests,reliability,httpd
1246,ImapMenu,Action if no coordinates are given when calling an imagemap,others,httpd
1247,IncludeOptional,Includes other configuration files from within the server configuration files,environment,httpd
1248,IndexHeadInsert,Inserts text in the HEAD section of an index page.,others,httpd
1249,IndexIgnore,Adds to the list of files to hide when listing a directory,others,httpd
1250,IndexIgnoreReset,Empties the list of files to hide when listing a directory,others,httpd
1251,IndexOptions,Various configuration settings for directory indexing,environment,httpd
1252,IndexOrderDefault,Sets the default ordering of the directory index,others,httpd
1253,IndexStyleSheet,Adds a CSS stylesheet to the directory index,environment,httpd
1254,ISAPIAppendLogToErrors,Record HSE_APPEND_LOG_PARAMETER requests from ISAPI extensions to the error log,debuggability,httpd
1255,ISAPIAppendLogToQuery,Record HSE_APPEND_LOG_PARAMETER requests from ISAPI extensions to the query field,debuggability,httpd
1256,ISAPIReadAheadBuffer,Size of the Read Ahead Buffer sent to ISAPI extensions,performance,httpd
1257,KeepAlive,Enables HTTP persistent connections,reliability,httpd
1258,KeepAliveTimeout,Amount of time the server will wait for subsequent requests on a persistent connection,reliability,httpd
1259,LDAPCacheEntries,Maximum number of entries in the primary LDAP cache,performance,httpd
1260,LDAPCacheTTL,Time that cached items remain valid,reliability,httpd
1261,LDAPConnectionPoolTTL,Discard backend connections that have been sitting in the connection pool too long,reliability,httpd
1262,LDAPConnectionTimeout,Specifies the socket connection timeout in seconds,reliability,httpd
1263,LDAPLibraryDebug,Enable debugging in the LDAP SDK,debuggability,httpd
1264,LDAPOpCacheEntries,Number of entries used to cache LDAP compare operations,performance,httpd
1265,LDAPOpCacheTTL,Time that entries in the operation cache remain valid,performance,httpd
1266,LDAPSharedCacheFile,Sets the shared memory cache file,environment,httpd
1267,LDAPSharedCacheSize,Size in bytes of the shared-memory cache,performance,httpd
1268,LDAPTimeout,"Specifies the timeout for LDAP search and bind operations, in seconds",reliability,httpd
1269,LimitInternalRecursion,Determine maximum number of internal redirects and nested subrequests,reliability,httpd
1270,LimitRequestBody,Restricts the total size of the HTTP request body sent from the client,reliability,httpd
1271,LimitRequestFields,Limits the number of HTTP request header fields that will be accepted from the client,reliability,httpd
1272,LimitRequestFieldSize,Limits the size of the HTTP request header allowed from the client,reliability,httpd
1273,LimitRequestLine,Limit the size of the HTTP request line that will be accepted from the client,reliability,httpd
1274,LimitXMLRequestBody,Limits the size of an XML-based request body,reliability,httpd
1275,Listen,IP addresses and ports that the server listens to,environment,httpd
1276,ListenCoresBucketsRatio,Ratio between the number of CPU cores (online) and the number of listeners' buckets,performance,httpd
1277,LogLevel,Controls the verbosity of the ErrorLog,debuggability,httpd
1278,LuaCodeCache,Configure the compiled code cache.,performance,httpd
1279,LuaInherit,Controls how parent configuration sections are merged into children,others,httpd
1280,MaxConnectionsPerChild,Limit on the number of connections that an individual child server will handle during its life,reliability,httpd
1281,MaxKeepAliveRequests,Number of requests allowed on a persistent connection,reliability,httpd
1282,MaxMemFree,Maximum amount of memory that the main allocator is allowed to hold without calling free(),reliability,httpd
1283,MaxRangeOverlaps,"Number of overlapping ranges (eg: 100-200,150-300) allowed before returning the complete resource",others,httpd
1284,MaxRangeReversals,"Number of range reversals (eg: 100-200,50-70) allowed before returning the complete resource",others,httpd
1285,MaxRanges,Number of ranges allowed before returning the complete resource,others,httpd
1286,MaxRequestWorkers,Maximum number of connections that will be processed simultaneously,performance,httpd
1287,MaxSpareServers,Maximum number of idle child server processes,performance,httpd
1288,MaxSpareThreads,Maximum number of idle threads,performance,httpd
1289,MaxThreads,Set the maximum number of worker threads,performance,httpd
1290,MDBaseServer,Control if base server may be managed or only virtual hosts.,others,httpd
1291,MDCertificateProtocol,The protocol to use with the Certificate Authority.,security,httpd
1292,MDCertificateStatus,Exposes public certificate information in JSON.,security,httpd
1293,MDHttpProxy,Define a proxy for outgoing connections.,environment,httpd
1294,MDMember,Additional hostname for the managed domain.,environment,httpd
1295,MDMustStaple,Control if new certificates carry the OCSP Must Staple flag.,security,httpd
1296,MDNotifyCmd,Run a program when a Managed Domain is ready.,environment,httpd
1297,MDPortMap,Map external to internal ports for domain ownership verification.,others,httpd
1298,MDPrivateKeys,Set type and size of the private keys generated.,security,httpd
1299,MDRenewMode,Controls if certificates shall be renewed.,security,httpd
1300,MDRenewWindow,Control when a certificate will be renewed.,security,httpd
1301,MDStapling,Enable stapling for all or a particular MDomain.,environment,httpd
1302,MDStaplingKeepResponse,Controls when old responses should be removed.,reliability,httpd
1303,MDWarnWindow,Define the time window when you want to be warned about an expiring certificate.,reliability,httpd
1304,MemcacheConnTTL,Keepalive time for idle connections,reliability,httpd
1305,MergeTrailers,Determines whether trailers are merged into headers,others,httpd
1306,MetaDir,Name of the directory to find CERN-style meta information files,environment,httpd
1307,MetaFiles,Activates CERN meta-file processing,security,httpd
1308,MetaSuffix,File name suffix for the file containing CERN-style meta information,others,httpd
1309,MinSpareThreads,Minimum number of idle threads available to handle request spikes,performance,httpd
1310,NameVirtualHost,DEPRECATED: Designates an IP address for name-virtual hosting,environment,httpd
1311,NoProxy,"Hosts, domains, or networks that will be connected to directly",environment,httpd
1312,NWSSLTrustedCerts,List of additional client certificates,security,httpd
1313,Options,Configures what features are available in a particular directory,others,httpd
1314,PidFile,File where the server records the process ID of the daemon,debuggability,httpd
1315,PrivilegesMode,Trade off processing speed and efficiency vs security against malicious privileges-aware code.,security,httpd
1316,Protocol,Protocol for a listening socket,others,httpd
1317,Protocols,Protocols available for a server/virtual host,others,httpd
1318,ProtocolsHonorOrder,Determines if order of Protocols determines precedence during negotiation,security,httpd
1319,ProxyAddHeaders,Add proxy information in X-Forwarded-* headers,security,httpd
1320,ProxyBlock,"Words, hosts, or domains that are banned from being proxied",security,httpd
1321,ProxyDomain,Default domain name for proxied requests,environment,httpd
1322,ProxyFCGIBackendType,Specify the type of backend FastCGI application,environment,httpd
1323,ProxyFCGISetEnvIf,Allow variables sent to FastCGI servers to be fixed up,reliability,httpd
1324,ProxyFtpEscapeWildcards,Whether wildcards in requested filenames are escaped when sent to the FTP server,others,httpd
1325,ProxyHCTPsize,Sets the total server-wide size of the threadpool used for the health check workers,performance,httpd
