idx,name,description,label,software
0,file,Specifies the path of the server log file for logging. ,debuggability,aerospike
1,context,Specifies the context and level of logging to be logged.,debuggability,aerospike
2,cache-enabled,"Whether to enable caching of Lua states for each registered Lua module, to benefit performance.",performance,aerospike
3,user-path,Directory to be used by the Aerospike process to store user generated UDF files,environment,aerospike
4,allow-nonxdr-writes,Parameter to control the writes done by a non-XDR client. Setting it to false will disallow all the writes from a nonXDR client (any regular client library). ,security,aerospike
5,allow-xdr-writes,Parameter to control whether to accept write transactions originating from an XDR client.,security,aerospike
6,cold-start-evict-ttl,This sets the TTL below which records will be evicted (will not be loaded) during coldstart. ,reliability,aerospike
7,data-in-index,"Optimization in single bin case, will only allow integer or float stored in index space. ",performance,aerospike
8,default-ttl,Default time-to-live (in seconds) for a record from the time of creation or last update. ,reliability,aerospike
9,disable-cold-start-eviction,"If true, disables eviction that may occur at cold start for this namespace only.",reliability,aerospike
10,disable-nsup,"If true , disables NSUP primary index reductions for this namespace only. ",performance,aerospike
11,disable-write-dup-res,Disables write duplicate resolution for the namespace. ,performance,aerospike
12,enable-benchmarks-batch-sub,Enable histograms for batch sub transactions.,debuggability,aerospike
13,enable-benchmarks-fabric,Enable histograms for fabric. ,debuggability,aerospike
14,enable-benchmarks-read,Enable histograms for read transactions. ,debuggability,aerospike
15,enable-benchmarks-storage,Enable histograms for storage access.,debuggability,aerospike
16,enable-benchmarks-svc,Enable histograms for demarshal and transaction queue related operations. ,debuggability,aerospike
17,enable-benchmarks-udf,Enable histograms for udf transactions.,debuggability,aerospike
18,enable-benchmarks-udf-sub,Enable histograms for udf sub transactions. ,debuggability,aerospike
19,enable-benchmarks-write,Enable histograms for write transactions.,debuggability,aerospike
20,enable-hist-info,Enable histograms for info protocol transactions.,debuggability,aerospike
21,enable-hist-proxy,Enable histograms for proxy transactions. ,debuggability,aerospike
22,enable-xdr,"This controls, at the namespace level, whether digest log entries are being written to the digest log.",debuggability,aerospike
23,evict-hist-buckets,Number of histogram buckets used for evictions. ,performance,aerospike
24,evict-tenths-pct,Maximum 1/10th percentage of objects to be deleted during each iteration of eviction.,reliability,aerospike
25,high-water-disk-pct,Data will be evicted if the disk utilization is greater than this specified percentage.,reliability,aerospike
26,high-water-memory-pct,Data will be evicted if the memory utilization is greater than this specified percentage.,reliability,aerospike
27,max-ttl,Maximum TTL allowed in the server. ,reliability,aerospike
28,memory-size,Maximum amount of memory for the namespace. ,reliability,aerospike
29,migrate-order,Number between 1 and 10 which determines the order namespaces are to be processed when migrating,others,aerospike
30,migrate-retransmit-ms,"How long to wait for success, in milliseconds, before retrying a migration related transaction. ",reliability,aerospike
31,migrate-sleep,Number of microseconds to sleep after each record migration. ,reliability,aerospike
32,ns-forward-xdr-writes,This parameter provides fine grained control at namespace level to forward writes that originated from another XDR to the specified destination datacenters (in xdr section). ,reliability,aerospike
33,partition-tree-sprigs,Number of tree sprigs to use.  Providing more trees (sprigs) reduces the number of levels and speeds up the search.,performance,aerospike
34,prefer-uniform-balance,"If true, this namespace will make an effort to distribute partitions evenly to all nodes. ",performance,aerospike
35,read-consistency-level-override,"When set to a non-default value, overrides the client-specified per-transaction read consistency level for this namespace. ",performance,aerospike
36,replication-factor,Number of copies of a record (including the master copy) maintained in the entire cluster.,reliability,aerospike
37,sets-enable-xdr,Specifies whether XDR should ship all sets in a namespace or not.,reliability,aerospike
38,single-bin,Setting it true will disallow multiple bin (columns) for a record.,others,aerospike
39,stop-writes-pct,"Disallow writes (except deletes, replica writes and migration writes) when memory utilization (tracked under memory_used_bytes ) is above this specified percentage.",reliability,aerospike
40,strong-consistency,Set the namespace to Strong Consistency mode to favor consistency over availability. ,reliability,aerospike
41,strong-consistency-allow-expunge,"When set to true , allows non-durable deletes to be used with strong-consistency .",reliability,aerospike
42,tomb-raider-eligible-age,Number of seconds to retain a tombstone,reliability,aerospike
43,tomb-raider-period,"Minimum amount of time, in seconds, between tomb-raider runs. ",reliability,aerospike
44,transaction-pending-limit,Maximum pending transactions that can be queued up to work on the same key.,reliability,aerospike
45,write-commit-level-override,"When set to a non-default value, overrides the client-specified per-transaction write commit level for this namespace.",reliability,aerospike
46,xdr-remote-datacenter,Name of the datacenter to forward this namespace to,others,aerospike
47,max-cells,Sets the maximum desired number of cells in the approximation. ,reliability,aerospike
48,max-level,Maximum depth to go for a single cell,reliability,aerospike
49,mount,Path to the mount directory (typically on NVMe SSD).,environment,aerospike
50,mounts-high-water-pct,Data will be evicted if the mount's utilization is greater than this specified percentage,reliability,aerospike
51,mounts-size-limit,Maximum amount of device space for the mount(s) on this namespace. ,reliability,aerospike
52,set-enable-xdr,Set-specific parameter to enable/disable shipping through XDR,reliability,aerospike
53,cold-start-empty,Setting this to true will cause cold start to ignore existing data on drives and start as if empty. Does not affect warm start.,others,aerospike
54,commit-to-device,Wait for write to flush to disk before acknowledging the client. ,reliability,aerospike
55,compression,"Use of this item requires a feature-key-file , and specifies the algorithm used to compress records on SSD.",performance,aerospike
56,compression-level,The compression level to use with zstd compression. A higher level means more but slower compression. ,performance,aerospike
57,data-in-memory,Keep a copy of all data in memory always.,reliability,aerospike
58,defrag-queue-min,Don't defrag unless the queue has this many eligible wblocks.,performance,aerospike
59,defrag-sleep,Number of microseconds to sleep after each wblock defragged.,reliability,aerospike
60,device,Raw device used to store the namespace.,environment,aerospike
61,direct-files," If direct-files is set true , then the odirect and odsync flags are enabled for file IO. ",reliability,aerospike
62,enable-osync,Tells the device to flush on every write. This may impact performance. ,performance,aerospike
63,encryption,Specifies the algorithm used by encryption at rest. ,security,aerospike
64,encryption-key-file,Enables encryption at rest by providing the location of the encryption key file.,security,aerospike
65,file,Data file path on rotational disk (using a file system).,environment,aerospike
66,filesize,Maximum size for each file storage defined in this namespace.,reliability,aerospike
67,flush-max-ms,Configures the maximum amount of time that a Streaming Write Buffer (SWB) can go without being written to device. ,reliability,aerospike
68,max-write-cache,Number of bytes (should be multiple of write-block-size) the system is allowed to keep pending write blocks before failing writes.,performance,aerospike
69,post-write-queue,Write block buffers to keep as cache (per device). ,performance,aerospike
70,read-page-cache,This allows the OS to leverage page cache and can help with latencies for some workload types. ,performance,aerospike
71,tomb-raider-sleep,Number of microseconds to sleep in between large block reads on disk. ,reliability,aerospike
72,write-block-size,Size in bytes of each I/O block that is written to the disk. ,performance,aerospike
73,channel-bulk-fds,Number of bulk channel sockets to open to each neighbor node. ,performance,aerospike
74,channel-bulk-recv-threads,Number of threads processing intra-cluster messages arriving through the bulk channel.,performance,aerospike
75,channel-meta-recv-threads,Number of threads processing intra-cluster messages arriving through the meta channel. ,performance,aerospike
76,channel-rw-fds,Number of read/write channel sockets to open to each neighbor node. ,performance,aerospike
77,channel-rw-recv-threads,Number of threads processing intra-cluster messages arriving through the rw (read/write) channel.,performance,aerospike
78,keepalive-enabled,Enables the nodes to send keep-alive messages to each other,reliability,aerospike
79,keepalive-intvl,Interval in seconds between successive keep-alive packets.,reliability,aerospike
80,keepalive-time,Time in seconds from the last user data packet sent on the socket before sending the first keep-alive packet.,reliability,aerospike
81,port,Port for inter-node communication within a cluster.,environment,aerospike
82,send-threads,Number of intra-node send threads to be used. ,performance,aerospike
83,address,IP address for cluster-state heartbeat communication for mesh.,environment,aerospike
84,interval,Interval in milliseconds in which heartbeats are sent.,reliability,aerospike
85,mcast-ttl,TTL for multicast packets.,reliability,aerospike
86,mesh-seed-address-port,Mesh address (host-name or IP) and port info for seed server(s). ,environment,aerospike
87,multicast-group,IP address for cluster-state heartbeat communication over multicast,environment,aerospike
88,port,Port for cluster-state communication (mesh or multicast).,environment,aerospike
89,protocol,Heartbeat protocol version to be used by cluster. ,environment,aerospike
90,timeout,Number of missing heartbeats after which the remote node will be declared dead.,reliability,aerospike
91,port,Port used for info management. ,environment,aerospike
92,access-address,An access address is an IP address that is announced to clients and used by clients for connecting to the cluster.,environment,aerospike
93,address,The IP address at which the server listens for client connections. ,environment,aerospike
94,alternate-access-address,Can be used to choose a specific IP address or DNS name that will be published as an alternate list for clients to connect,environment,aerospike
95,port,The port at which the server listens for client connections.,environment,aerospike
96,tls-name,this parameter specifies which TLS parameters to use for the given context TLS connections. ,security,aerospike
97,tls-port,"Port that is TLS enabled at which the server listens for client connections, heartbeat connections or fabric connections (based on the subcontext this is set at).",environment,aerospike
98,ca-file,Path to the CA file needed for mutual authentication.,environment,aerospike
99,ca-path,Path to the directory of the CA file for mutual authentication. ,environment,aerospike
100,cert-blacklist,Path to the file containing rogue certificates serial numbers. ,environment,aerospike
101,cert-file,Path to the TLS certificate file when TLS is enabled.,environment,aerospike
102,key-file,Path to the key file when TLS is enabled. ,security,aerospike
103,key-file-password,Password for the key-file . ,security,aerospike
104,enable-security,Enable access control. ,security,aerospike
105,privilege-refresh-period,Frequency in seconds with which the node verifies credentials and permissions for active client connections.,security,aerospike
106,polling-period,How frequently (in seconds) to query the LDAP server for user group membership information. ,security,aerospike
107,query-base-dn,Distinguished name of the LDAP directory entry at which to begin the search when querying for a user's group membership information.,environment,aerospike
108,query-user-dn,Distinguished name of the user designated for user group membership queries.,environment,aerospike
109,server,Name of the LDAP server to use. ,environment,aerospike
110,session-ttl,"Lifetime (in seconds) of an access token. A TCP connection attempt with an expired token will fail, and the clien must log in again to get a fresh token. ",reliability,aerospike
111,tls-ca-file,Path to the CA certificate file used for validating TLS connections to the LDAP server.,security,aerospike
112,token-hash-method,Hash algorithm to use when generating the HMAC for access tokens. ,security,aerospike
113,report-authentication,Set to true to report successful authentications in aerospike.log.,debuggability,aerospike
114,report-data-op,Set to true to report on data transactions for a namespace (and optionally a set).,debuggability,aerospike
115,report-sys-admin,Set to true to report systems administration operations,security,aerospike
116,report-user-admin,Set to true to report successful user administration operations ,security,aerospike
117,report-violation,Set to true to report security violations ,security,aerospike
118,report-authentication,Set to true to report successful authentications in the syslog file.,debuggability,aerospike
119,report-user-admin,Set to true to report successful user administration operations in the syslog file.,debuggability,aerospike
120,report-violation,Set to true to report security violations in the syslog file.,security,aerospike
121,advertise-ipv6,Requires heartbeat v3. Set to true in order enable IPv6.,environment,aerospike
122,batch-index-threads,Number of batch index response worker threads. ,performance,aerospike
123,batch-max-buffers-per-queue,Number of 128 KiB response buffers allowed in each batch index queue before it is marked as full. ,performance,aerospike
124,batch-max-requests,Max number of keys allowed per node.,reliability,aerospike
125,enable-health-check,Monitors the health of a cluster and attempts to idendity potential outlier nodes. ,reliability,aerospike
126,feature-key-file,Location of the digitally signed feature key file containing the features that are enabled,security,aerospike
127,hist-track-back,Total time span in seconds over which to cache data.,performance,aerospike
128,info-threads,Number of threads to create to process info requests.,performance,aerospike
129,log-local-time,Set this configuration to true to set logs to have local time stamp ,debuggability,aerospike
130,log-millis,Set this to true in order to get millisecond timestamps in the log file.,others,aerospike
131,migrate-fill-delay,Number of seconds to delay before starting 'fill' migrations. ,reliability,aerospike
132,migrate-threads,Number of threads per server allocated for data migration.,performance,aerospike
133,min-cluster-size,The minimum number of nodes required for a cluster to form. ,performance,aerospike
134,nsup-delete-sleep,Number of microseconds to sleep between generating delete transactions.,reliability,aerospike
135,nsup-delete-sleep,The interval (secs) at which expiration/eviction thread (namespace supervisor) wakes up.,reliability,aerospike
136,cluster_name,The name of the cluster. This is mainly used to prevent machines in one logical cluster from joining another.,others,cassandra
137,num_tokens,"This defines the number of tokens randomly assigned to this node on the ring The more tokens, relative to other nodes, the larger the proportion of data that this node will store. ",performance,cassandra
138,allocate_tokens_for_keyspace,Triggers automatic allocation of num_tokens tokens for this node. The allocation algorithm attempts to choose tokens in a way that optimizes replicated load over the nodes in the datacenter for the replication strategy used by the specified keyspace.,performance,cassandra
139,initial_token,"initial_token allows you to specify tokens manually. While you can use it with vnodes (num_tokens > 1, above) in which case you should provide a comma-separated list it's primarily used when adding nodes to legacy clusters that do not have vnodes enabled.",others,cassandra
140,hinted_handoff_enabled,"If a write is made and a replica node for the key is down (and hinted_handoff_enabled == true), Cassandra will write a hint.",reliability,cassandra
141,hinted_handoff_disabled_datacenters,"When hinted_handoff_enabled is true, a black list of data centers that will not perform hinted handoff",reliability,cassandra
142,max_hint_window_in_ms,"this defines the maximum amount of time a dead host will have hints generated. After it has been dead this long, new hints for it will not be created until it has been seen alive and gone down again.",reliability,cassandra
143,hinted_handoff_throttle_in_kb,"Maximum throttle in KBs per second, per delivery thread. This will be reduced proportionally to the number of nodes in the cluster. ",reliability,cassandra
144,max_hints_delivery_threads,"Number of threads with which to deliver hints; Consider increasing this number when you have multi-dc deployments, since cross-dc handoff tends to be slower",performance,cassandra
145,hints_directory,"Directory where Cassandra should store hints. If not set, the default directory is $CASSANDRA_HOME/data/hints.",environment,cassandra
146,hints_flush_period_in_ms,How often hints should be flushed from the internal buffers to disk. Will not trigger fsync.,reliability,cassandra
147,max_hints_file_size_in_mb,"Maximum size for a single hints file, in megabytes.",reliability,cassandra
148,hints_compression,"Compression to apply to the hint files. If omitted, hints files will be written uncompressed. LZ4, Snappy, and Deflate compressors are supported.",performance,cassandra
149,batchlog_replay_throttle_in_kb,"Maximum throttle in KBs per second, total. This will be reduced proportionally to the number of nodes in the cluster.",reliability,cassandra
150,authenticator,"Authentication backend, implementing IAuthenticator; used to identify users Out of the box, Cassandra provides org.apache.cassandra.auth.{AllowAllAuthenticator, PasswordAuthenticator}.",security,cassandra
151,authorizer,"Authorization backend, implementing IAuthorizer; used to limit access/provide permissions Out of the box, Cassandra provides org.apache.cassandra.auth.{AllowAllAuthorizer, CassandraAuthorizer}.",security,cassandra
152,role_manager,"Part of the Authentication & Authorization backend, implementing IRoleManager; used to maintain grants and memberships between roles. ",security,cassandra
153,roles_validity_in_ms,"Validity period for roles cache (fetching granted roles can be an expensive operation depending on the role manager, CassandraRoleManager is one example) Granted roles are cached for authenticated sessions in AuthenticatedUser and after the period specified here, become eligible for (async) reload.",security,cassandra
154,roles_update_interval_in_ms,"Refresh interval for roles cache (if enabled). After this interval, cache entries become eligible for refresh. Upon next access, an async reload is scheduled and the old value returned until it completes. ",reliability,cassandra
155,permissions_validity_in_ms,"Validity period for permissions cache (fetching permissions can be an expensive operation depending on the authorizer, CassandraAuthorizer is one example).",performance,cassandra
156,permissions_update_interval_in_ms,"Refresh interval for permissions cache (if enabled). After this interval, cache entries become eligible for refresh.",reliability,cassandra
157,credentials_validity_in_ms,"Please note, credentials are cached in their encrypted form, so while activating this cache may reduce the number of queries made to the underlying table, it may not bring a significant reduction in the latency of individual authentication attempts.",security,cassandra
158,credentials_update_interval_in_ms,"Refresh interval for credentials cache (if enabled). After this interval, cache entries become eligible for refresh. ",reliability,cassandra
159,partitioner,The partitioner is responsible for distributing groups of rows (by partition key) across nodes in the cluster. You should leave this alone for new clusters. ,others,cassandra
160,data_file_directories,Directories where Cassandra should store data on disk.,environment,cassandra
161,commitlog_directory,"commit log. when running on magnetic HDD, this should be a separate spindle than the data directories.",debuggability,cassandra
162,cdc_enabled,Enable / disable CDC functionality on a per-node basis.,debuggability,cassandra
163,cdc_raw_directory,CommitLogSegments are moved to this directory on flush if cdc_enabled: true and the segment contains mutations for a CDC-enabled table.,debuggability,cassandra
164,disk_failure_policy,Policy for data disk failures,reliability,cassandra
165,commit_failure_policy,Policy for commit disk failures,reliability,cassandra
166,prepared_statements_cache_size_mb,Maximum size of the native protocol prepared statement cache,reliability,cassandra
167,key_cache_size_in_mb,"The key cache is fairly tiny for the amount of time it saves, so it's worthwhile to use it at large numbers. The row cache saves even more time, but must contain the entire row, so it is extremely space-intensive. ",performance,cassandra
168,key_cache_save_period,"Saved caches greatly improve cold-start speeds, and is relatively cheap in terms of I/O for the key cache. Row cache saving is much more expensive and has limited use.",performance,cassandra
169,key_cache_keys_to_save,"Number of keys from the key cache to save Disabled by default, meaning all keys are going to be saved",performance,cassandra
170,row_cache_class_name,Row cache implementation class name.,performance,cassandra
171,row_cache_size_in_mb,Maximum size of the row cache in memory. ,performance,cassandra
172,row_cache_save_period,"Duration in seconds after which Cassandra should save the row cache.  Saved caches greatly improve cold-start speeds, and is relatively cheap in terms of I/O for the key cache. Row cache saving is much more expensive and has limited use.",performance,cassandra
173,row_cache_keys_to_save,"Number of keys from the row cache to save. Specify 0 (which is the default), meaning all keys are going to be saved",performance,cassandra
174,counter_cache_size_in_mb,Maximum size of the counter cache in memory.,performance,cassandra
175,counter_cache_save_period,Duration in seconds after which Cassandra should save the counter cache (keys only). Caches are saved to saved_caches_directory as specified in this configuration file.,performance,cassandra
176,counter_cache_keys_to_save,"Number of keys from the counter cache to save Disabled by default, meaning all keys are going to be saved",performance,cassandra
177,saved_caches_directory,"saved caches If not set, the default directory is $CASSANDRA_HOME/data/saved_caches.",environment,cassandra
178,commitlog_sync,This window should be kept short because the writer threads will be unable to do extra work while waiting.,debuggability,cassandra
179,commitlog_segment_size_in_mb,"The size of the individual commitlog file segments. A commitlog segment may be archived, deleted, or recycled once all the data in it (potentially from each columnfamily in the system) has been flushed to sstables.",debuggability,cassandra
180,commitlog_compression,"Compression to apply to the commit log. If omitted, the commit log will be written uncompressed.",performance,cassandra
181,concurrent_reads,concurrent_reads should be set to (16 * number_of_drives) in order to allow the operations to enqueue low enough in the stack that the OS and drives can reorder them.,performance,cassandra
182,concurrent_writes,"since writes are almost never IO bound, the ideal number of concurrent_writes is dependent on the number of cores in your system; (8 * number_of_cores) is a good rule of thumb.",performance,cassandra
183,concurrent_materialized_view_writes,"For materialized view writes, as there is a read involved, so this should be limited by the less of concurrent reads or concurrent writes.",performance,cassandra
184,file_cache_size_in_mb,Maximum memory to use for sstable chunk cache and buffer pooling.,performance,cassandra
185,memtable_heap_space_in_mb,"Total permitted memory to use for memtables. Cassandra will stop accepting writes when the limit is exceeded until a flush completes, and will trigger a flush based on memtable_cleanup_threshold ",reliability,cassandra
186,memtable_cleanup_threshold,"Ratio of occupied non-flushing memtable size to total permitted size that will trigger a flush of the largest memtable. Larger mct will mean larger flushes and hence less compaction, but also less concurrent flush activity which can make it difficult to keep your disks fed under heavy write load.",reliability,cassandra
187,memtable_allocation_type,Specify the way Cassandra allocates and manages memtable memory. ,performance,cassandra
188,commitlog_total_space_in_mb,Total space to use for commit logs on disk.,debuggability,cassandra
189,memtable_flush_writers,This sets the number of memtable flush writer threads per disk as well as the total number of memtables that can be flushed concurrently. These are generally a combination of compute and IO bound.,performance,cassandra
190,cdc_total_space_in_mb,Total space to use for change-data-capture logs on disk.,debuggability,cassandra
