idx,name,description,label,software
2644,password_regex,"The regular expression used to validate password strength  requirements. By default, the regular expression will match any  password. The following is an example of a pattern which requires at  least 1 letter, 1 digit, and have a minimum length of 7 characters:  ^(?=.*d)(?=.*[a-zA-Z]).{7,}$ This feature depends on the sql backend for the [identity] driver.",security,keystone
2645,password_regex_description,"Describe your password regular expression here in language for  humans. If a password fails to match the regular expression, the  contents of this configuration variable will be returned to users to  explain why their requested password was insufficient.",security,keystone
2646,change_password_upon_first_use,"Enabling this option requires users to change their password when the user is created, or upon administrative reset. Before accessing any  services, affected users will have to change their password. To ignore  this requirement for specific users, such as service users, set the options attribute ignore_change_password_upon_first_use to True for the desired user via the update user API. This feature is disabled by default. This feature is only applicable with the sql backend for the [identity] driver.",security,keystone
2647,driver,"Entry point for the shadow users backend driver in the keystone.identity.shadow_users namespace. This driver is used for persisting local user references to  externally-managed identities (via federation, LDAP, etc). Keystone only provides a sql driver, so there is no reason to change this option unless you are providing a custom entry point.",environment,keystone
2648,certfile,"Absolute path to the public certificate file to use for signing responses to revocation lists requests. Set this together with [signing] keyfile. For non-production environments, you may be interested in using keystone-manage pki_setup to generate self-signed certificates.",security,keystone
2649,keyfile,Absolute path to the private key file to use for signing responses to revocation lists requests. Set this together with [signing] certfile.,environment,keystone
2650,ca_certs,Absolute path to the public certificate authority (CA) file to use when creating self-signed certificates with keystone-manage pki_setup. Set this together with [signing] ca_key. There is no reason to set this option unless you are requesting revocation lists in a non-production environment. Use a [signing] certfile issued from a trusted certificate authority instead.,security,keystone
2651,ca_key,Absolute path to the private certificate authority (CA) key file to use when creating self-signed certificates with keystone-manage pki_setup. Set this together with [signing] ca_certs. There is no reason to set this option unless you are requesting revocation lists in a non-production environment. Use a [signing] certfile issued from a trusted certificate authority instead.,security,keystone
2652,key_size,Key size (in bits) to use when generating a self-signed token signing certificate. There is no reason to set this option unless you are  requesting revocation lists in a non-production environment. Use a [signing] certfile issued from a trusted certificate authority instead.,security,keystone
2653,valid_days,The validity period (in days) to use when generating a self-signed  token signing certificate. There is no reason to set this option unless  you are requesting revocation lists in a non-production environment. Use a [signing] certfile issued from a trusted certificate authority instead.,reliability,keystone
2654,cert_subject,The certificate subject to use when generating a self-signed token  signing certificate. There is no reason to set this option unless you  are requesting revocation lists in a non-production environment. Use a [signing] certfile issued from a trusted certificate authority instead.,security,keystone
2655,expiration,"The amount of time that a token should remain valid (in seconds).  Drastically reducing this value may break 'long-running' operations that involve multiple services to coordinate together, and will force users  to authenticate with keystone more frequently. Drastically increasing  this value will increase the number of tokens that will be  simultaneously valid. Keystone tokens are also bearer tokens, so a  shorter duration will also reduce the potential security impact of a  compromised token.",reliability,keystone
2656,provider,"Entry point for the token provider in the keystone.token.provider namespace. The token provider controls the token construction,  validation, and revocation operations. Supported upstream providers are fernet and jws. Neither fernet or jws tokens require persistence and both require additional setup. If using fernet, you're required to run keystone-manage fernet_setup, which creates symmetric keys used to encrypt tokens. If using jws, you're required to generate an ECDSA keypair using a SHA-256 hash  algorithm for signing and validating token, which can be done with keystone-manage create_jws_keypair. Note that fernet tokens are encrypted and jws tokens are only signed. Please be sure to consider this if your  deployment has security requirements regarding payload contents used to  generate token IDs.",security,keystone
2657,caching,Toggle for caching token creation and validation data. This has no effect unless global caching is enabled.,performance,keystone
2658,cache_time,The number of seconds to cache token creation and validation data. This has no effect unless both global and [token] caching are enabled.,performance,keystone
2659,revoke_by_id,This toggles support for revoking individual tokens by the token  identifier and thus various token enumeration operations (such as  listing all tokens issued to a specific user). These operations are used to determine the list of tokens to consider revoked. Do not disable  this option if you're using the kvs [revoke] driver.,security,keystone
2660,allow_rescope_scoped_token,"This toggles whether scoped tokens may be re-scoped to a new project  or domain, thereby preventing users from exchanging a scoped token  (including those with a default project scope) for any other token. This forces users to either authenticate for unscoped tokens (and later  exchange that unscoped token for tokens with a more specific scope) or  to provide their credentials in every request for a scoped token to  avoid re-scoping altogether.",security,keystone
2661,infer_roles,"This controls whether roles should be included with tokens that are  not directly assigned to the token's scope, but are instead linked  implicitly to other role assignments.",security,keystone
2662,cache_on_issue,Enable storing issued token data to token validation cache so that  first token validation doesn't actually cause full validation cycle.  This option has no effect unless global caching is enabled and will  still cache tokens even if [token] caching = False.,performance,keystone
2663,allow_expired_window,This controls the number of seconds that a token can be retrieved for beyond the built-in expiry time. This allows long running operations to succeed. Defaults to two days.,reliability,keystone
2664,trusted_issuer,"The list of distinguished names which identify trusted issuers of  client certificates allowed to use X.509 tokenless authorization. If the option is absent then no certificates will be allowed. The format for  the values of a distinguished name (DN) must be separated by a comma and contain no spaces. Furthermore, because an individual DN may contain  commas, this configuration option may be repeated multiple times to  represent multiple values. For example, keystone.conf would include two  consecutive lines in order to trust two different DNs, such as trusted_issuer = CN=john,OU=keystone,O=openstack and trusted_issuer = CN=mary,OU=eng,O=abc.",security,keystone
2665,protocol,"The federated protocol ID used to represent X.509 tokenless authorization. This is used in combination with the value of [tokenless_auth] issuer_attribute to find a corresponding federated mapping. In a typical deployment, there is no reason to change this value.",security,keystone
2666,issuer_attribute,"The name of the WSGI environment variable used to pass the issuer of  the client certificate to keystone. This attribute is used as an  identity provider ID for the X.509 tokenless authorization along with  the protocol to look up its corresponding mapping. In a typical  deployment, there is no reason to change this value.",environment,keystone
2667,allow_redelegation,"Allows authorization to be redelegated from one user to another, effectively chaining trusts together. When disabled, the remaining_uses attribute of a trust is constrained to be zero.",security,keystone
2668,max_redelegation_count,Maximum number of times that authorization can be redelegated from  one user to another in a chain of trusts. This number may be reduced  further for a specific trust.,reliability,keystone
2669,driver,"Entry point for the trust backend driver in the keystone.trust namespace. Keystone only provides a sql driver, so there is no reason to change this unless you are providing a custom entry point.",environment,keystone
2670,driver,"Entry point for the unified limit backend driver in the keystone.unified_limit namespace. Keystone only provides a sql driver, so there's no reason to change this unless you are providing a custom entry point.",environment,keystone
2671,caching,"Toggle for unified limit caching. This has no effect unless global  caching is enabled. In a typical deployment, there is no reason to  disable this.",performance,keystone
2672,cache_time,"Time to cache unified limit data, in seconds. This has no effect unless both global caching and [unified_limit] caching are enabled.",performance,keystone
2673,list_limit,Maximum number of entities that will be returned in a role  collection. This may be useful to tune if you have a large number of  unified limits in your deployment.,performance,keystone
2674,enforcement_model,"The enforcement model to use when validating limits associated to  projects. Enforcement models will behave differently depending on the  existing limits, which may result in backwards incompatible changes if a model is switched in a running deployment.",performance,keystone
2675,debug_middleware,"If set to true, this enables the oslo debug middleware in Keystone.  This Middleware prints a lot of information about the request and the  response. It is useful for getting information about the data on the  wire (decoded) and passed to the WSGI application pipeline. This  middleware has no effect on the 'debug' setting in the [DEFAULT] section of the config file or setting Keystone's log-level to 'DEBUG'; it is  specific to debugging the WSGI data as it enters and leaves Keystone  (specific request-related data). This option is used for introspection  on the request and response data between the web server (apache, nginx,  etc) and Keystone.  This middleware is inserted as the first element in  the middleware chain and will show the data closest to the wire.   WARNING: NOT INTENDED FOR USE IN PRODUCTION. THIS MIDDLEWARE CAN AND  WILL EMIT SENSITIVE/PRIVILEGED DATA.",debuggability,keystone
2676,block_cache_capacity_mb,block cache capacity in MB,performance,kudu
2677,log_force_fsync_all,Whether the Log/WAL should explicitly call fsync() after each write.,performance,kudu
2678,fs_data_dirs,"Comma-separated list of directories with data blocks. If this is not specified, fs_wal_dir will be used as the sole data block directory",environment,kudu
2679,fs_metadata_dir,Directory with metadata.,environment,kudu
2680,fs_wal_dir,Directory with write-ahead logs.,debuggability,kudu
2681,master_addresses,"Comma-separated list of the RPC addresses belonging to all Masters in this cluster. NOTE: if not specified, configures a non-replicated Master.",environment,kudu
2682,rpc_bind_addresses,Comma-separated list of addresses to bind to for RPC connections.,environment,kudu
2683,keytab_file,Path to the Kerberos Keytab file for this server.,environment,kudu
2684,superuser_acl,"The list of usernames to allow as super users, comma-separated. ",security,kudu
2685,user_acl,"The list of usernames who may access the cluster, comma-separated.",security,kudu
2686,webserver_certificate_file,"The location of the debug webserver's SSL certificate file, in PEM format.",security,kudu
2687,webserver_port,Port to bind to for the web server,environment,kudu
2688,webserver_private_key_file,"The full path to the private key used as a counterpart to the public key contained in --webserver_certificate_file. If --webserver_certificate_file is set, this option must be set as well.",security,kudu
2689,webserver_private_key_password_cmd,"A Unix command whose output returns the password used to decrypt the Webserver's certificate private key file specified in --webserver_private_key_file. If the PEM key file is not password-protected, this flag does not need to be set.",security,kudu
2690,log_filename,Prefix of log filename ,debuggability,kudu
2691,maintenance_manager_num_threads,Size of the maintenance manager thread pool. ,performance,kudu
2692,memory_limit_hard_bytes,"Maximum amount of memory this daemon should use, in bytes.",performance,kudu
2693,version,show version and build info and exit,others,kudu
2694,log_dir,"If specified, logfiles are written into this directory instead of the default logging directory",environment,kudu
2695,enable_process_lifetime_heap_profiling,Enables heap profiling for the lifetime of the process. ,debuggability,kudu
2696,heap_profile_path,Output path to store heap profiles. ,environment,kudu
2697,unlock_unsafe_flags,Unlock flags marked as 'unsafe'.  Use at your own risk.,security,kudu
2698,helpxml,produce an xml version of help,others,kudu
2699,minloglevel,Messages logged at a lower level than this don't actually get logged anywhere,debuggability,kudu
2700,stderrthreshold,log messages at or above this level are copied to stderr in addition to logfiles. ,debuggability,kudu
2701,stop_logging_if_full_disk,Stop attempting to log to disk if the disk is full.,reliability,kudu
2702,symbolize_stacktrace,Symbolize the stack trace in the tombstone,debuggability,kudu
2703,cfile_verify_checksums,Verify the checksum for each block on read if one exists,reliability,kudu
2704,cfile_default_block_size,The default block size to use in cfiles,performance,kudu
2705,cfile_default_compression_codec,Default cfile block compression codec.,performance,kudu
2706,cfile_write_checksums,Write CRC32 checksums for each block,reliability,kudu
2707,max_clock_sync_error_usec,Maximum allowed clock synchronization error as reported by NTP before the server will abort.,reliability,kudu
2708,consensus_rpc_timeout_ms,Timeout used for all consensus internal RPC communications.,reliability,kudu
2709,consensus_max_batch_size_bytes,The maximum per-tablet RPC batch size when updating peers.,performance,kudu
2710,follower_unavailable_considered_failed_sec,Seconds that a leader is unable to successfully heartbeat to a follower after which the follower is considered to be failed and evicted from the config,reliability,kudu
2711,fs_wal_dir_reserved_bytes,Number of bytes to reserve on the log directory filesystem for non-Kudu usage. ,reliability,kudu
2712,global_log_cache_size_limit_mb,The total memory used for caching log entries across all tablets is kept under this threshold.,performance,kudu
2713,log_cache_size_limit_mb,The total per-tablet size of consensus entries which may be kept in memory. ,performance,kudu
2714,log_async_preallocate_segments,Whether the WAL segments preallocation should happen asynchronously,reliability,kudu
2715,log_preallocate_segments,Whether the WAL should preallocate the entire segment before writing to it,performance,kudu
2716,log_segment_size_mb,"The default size for log segments, in MB",performance,kudu
2717,evict_failed_followers,Whether to evict followers from the Raft config ,others,kudu
2718,leader_failure_max_missed_heartbeat_periods,Maximum heartbeat periods that the leader can fail to heartbeat in before we consider the leader to be failed. The total failure timeout in milliseconds is raft_heartbeat_interval_ms times,reliability,kudu
2719,safe_time_advancement_without_writes,"Whether to enable the advancement of ""safe"" time in the absense of write operations",reliability,kudu
2720,block_manager_max_open_files,Maximum number of open file descriptors to be used for data blocks.,reliability,kudu
2721,fs_data_dirs_full_disk_cache_seconds,"Number of seconds we cache the full-disk status in the block manager. During this time, writes to the corresponding root path will not be attempted",reliability,kudu
2722,fs_data_dirs_reserved_bytes,Number of bytes to reserve on each data directory filesystem for non-Kudu usage. ,reliability,kudu
2723,fs_target_data_dirs_per_tablet,Indicates the target number of data dirs to spread each tablet's data across. ,others,kudu
2724,default_num_replicas,Default number of replicas for tables that do not have the num_replicas set.,reliability,kudu
2725,master_ts_rpc_timeout_ms,Timeout used for the master to TS async rpc calls,reliability,kudu
2726,table_locations_ttl_ms,Maximum time in milliseconds which clients may cache table locations.,reliability,kudu
2727,tablet_creation_timeout_ms,Timeout used by the master when attempting to create tablet replicas during table creation.,reliability,kudu
2728,unresponsive_ts_rpc_timeout_ms,"After this amount of time, the master will stop attempting to contact a tablet server in order to perform operations such as deleting a tablet.",reliability,kudu
2729,tserver_unresponsive_timeout_ms,The period of time that a Master can go without receiving a heartbeat from a tablet server before considering it unresponsive.,reliability,kudu
2730,rpc_acceptor_listen_backlog,Socket backlog parameter used when listening for RPC connections. ,others,kudu
2731,rpc_encrypt_loopback_connections,Whether to encrypt data transfer on RPC connections that stay within a single host. ,security,kudu
2732,rpc_callback_max_cycles,The maximum number of cycles for which an RPC callback should be allowed to run without emitting a warning.,reliability,kudu
2733,remember_clients_ttl_ms,"Maximum amount of time, in milliseconds, the server ""remembers"" a client for the purpose of caching its responses.",performance,kudu
2734,rpc_dump_all_traces,"If true, dump all RPC traces at INFO level",debuggability,kudu
2735,rpc_duration_too_long_ms,Threshold (in milliseconds) above which a RPC is considered too long and its duration and method name are logged at INFO level. ,debuggability,kudu
2736,trusted_subnets,"A trusted subnet whitelist. If set explicitly, all unauthenticated or unencrypted connections are prohibited except the ones from the specified address blocks.",security,kudu
2737,rpc_max_message_size,The maximum size of a message that any RPC that the server will accept. ,reliability,kudu
2738,use_system_auth_to_local,"When enabled, use the system krb5 library to map Kerberos principal names to local (short) usernames.",others,kudu
2739,rpc_advertised_addresses,Comma-separated list of addresses to advertise externally for RPC connections.,environment,kudu
2740,rpc_num_acceptors_per_address,Number of RPC acceptor threads for each bound address,performance,kudu
2741,rpc_authentication,Whether to require RPC connections to authenticate.,security,kudu
2742,rpc_default_keepalive_time_ms,"If an RPC connection from a client is idle for this amount of time, the server will disconnect the client. Setting this to any negative value keeps connections always alive.",reliability,kudu
2743,rpc_encryption,Whether to require RPC connections to be encrypted. ,security,kudu
2744,rpc_negotiation_timeout_ms,Timeout for negotiating an RPC connection.,reliability,kudu
2745,rpc_tls_min_protocol,The minimum protocol version to allow when for securing RPC connections with TLS.,environment,kudu
2746,webserver_enabled,Whether to enable the web server on this daemon.,others,kudu
2747,metrics_log_interval_ms,Interval (in milliseconds) at which the server will dump its metrics to a local log file.,debuggability,kudu
2748,webserver_advertised_addresses,Comma-separated list of addresses to advertise externally for HTTP(S) connections.,environment,kudu
2749,webserver_authentication_domain,Domain used for debug webserver authentication,debuggability,kudu
2750,webserver_enable_doc_root,"If true, webserver may serve static files from the webserver_doc_root",others,kudu
2751,webserver_interface,Interface to start debug webserver on. ,debuggability,kudu
2752,tablet_bloom_block_size,Block size of the bloom filters used for tablet keys,performance,kudu
2753,tablet_history_max_age_sec,Number of seconds to retain tablet history. Reads initiated at a snapshot that is older than this age will be rejected.,reliability,kudu
2754,tablet_transaction_memory_limit_mb,Maximum amount of memory that may be consumed by all in-flight transactions belonging to a particular tablet.,reliability,kudu
2755,scanner_ttl_ms,Number of milliseconds of inactivity allowed for a scannerbefore it may be expired,reliability,kudu
2756,tablet_copy_begin_session_timeout_ms,Tablet server RPC client timeout for BeginTabletCopySession calls.,reliability,kudu
2757,tablet_copy_idle_timeout_sec,"Amount of time without activity before a tablet copy session will expire, in seconds",reliability,kudu
2758,num_tablets_to_copy_simultaneously,Number of threads available to copy tablets from remote servers.,performance,kudu
2759,num_tablets_to_delete_simultaneously,Number of threads available to delete tablets. ,performance,kudu
2760,num_tablets_to_open_simultaneously,Number of threads available to open tablets during startup,performance,kudu
2761,disable_core_dumps,Disable core dumps when this process crashes.,debuggability,kudu
2762,metrics_retirement_age_ms,The minimum number of milliseconds a metric will be kept for after it is no longer active.,reliability,kudu
2763,minidump_path,Directory to write minidump files to. ,environment,kudu
2764,minidump_size_limit_hint_kb,Size limit hint for minidump files in KB.,reliability,kudu
2765,memory_limit_soft_percentage,Percentage of the hard memory limit that this daemon may consume before memory throttling of writes begins. ,performance,kudu
2766,logbuflevel,Buffer log messages logged at this level or lower,debuggability,kudu
2767,logfile_mode,Log file mode/permissions.,security,kudu
2768,tserver_master_addrs,Comma separated addresses of the masters which the tablet server should connect to. ,environment,kudu
2769,log_prefix,Prepend the log prefix to the start of each log line,others,kudu
2770,remember_responses_ttl_ms,"Maximum amount of time, in milliseconds, the server ""remembers"" a response to a specific request for a client. ",reliability,kudu
2771,redact,Comma-separated list that controls redaction context. ,security,kudu
2772,enable_minidumps,Whether to enable minidump generation upon process crash or SIGUSR1. ,reliability,kudu
2773,max_minidumps,Maximum number of minidump files to keep per daemon.,reliability,kudu
2774,tcmalloc_max_free_bytes_percentage,Maximum percentage of the RSS that tcmalloc is allowed to use for reserved but unallocated memory.,reliability,kudu
2775,mapreduce.job.committer.setup.cleanup.needed,"true, if job needs job-setup and job-cleanup. false, otherwise",others,mapreduce
2776,mapreduce.task.io.sort.factor,The number of streams to merge at once while sorting files. This determines the number of open file handles.,performance,mapreduce
2777,mapreduce.task.io.sort.mb,"The total amount of buffer memory to use while sorting files, in megabytes. By default, gives each merge stream 1MB, which should minimize seeks.",performance,mapreduce
2778,mapreduce.map.sort.spill.percent,"The soft limit in the serialization buffer. Once reached, a thread will begin to spill the contents to disk in the background. Note that collection will not block if this threshold is exceeded while a spill is already in progress, so spills may be larger than this threshold when it is set to less than .5",reliability,mapreduce
2779,mapreduce.jobtracker.address,"The host and port that the MapReduce job tracker runs at. If ""local"", then jobs are run in-process as a single map and reduce task.",environment,mapreduce
2780,mapreduce.local.clientfactory.class.name,This the client factory that is responsible for creating local job runner client,others,mapreduce
2781,mapreduce.jobtracker.system.dir,The directory where MapReduce stores control files.,environment,mapreduce
2782,mapreduce.jobtracker.staging.root.dir,"The root of the staging area for users' job files In practice, this should be the directory where users' home directories are located (usually /user)",environment,mapreduce
2783,mapreduce.cluster.temp.dir,A shared directory for temporary files.,environment,mapreduce
2784,mapreduce.job.maps,"The default number of map tasks per job. Ignored when mapreduce.framework.name is ""local"".",performance,mapreduce
2785,mapreduce.job.reduces,"The default number of reduce tasks per job. Typically set to 99% of the cluster's reduce capacity, so that if a node fails the reduces can still be executed in a single wave. Ignored when mapreduce.framework.name is ""local"".",reliability,mapreduce
2786,mapreduce.job.running.map.limit,The maximum number of simultaneous map tasks per job. There is no limit if this value is 0 or negative.,reliability,mapreduce
2787,mapreduce.job.running.reduce.limit,The maximum number of simultaneous reduce tasks per job. There is no limit if this value is 0 or negative.,reliability,mapreduce
2788,mapreduce.job.max.map,Limit on the number of map tasks allowed per job. There is no limit if this value is negative.,reliability,mapreduce
